time_utc,time_mmt,latitude,longitude,depth,mag,location,country
2017-10-27 11:17:44,2017-10-27 17:47:44,16.79,96.1,20.0,3.4,"Gyaungwaing, Yangon Region, Myanmar (Burma)",MM
2017-10-21 12:19:34,2017-10-21 18:49:34,16.27,97.98,2.0,3.6,"Pathein, Mon State, Myanmar (Burma)",MM
2017-10-21 11:53:09,2017-10-21 18:23:09,16.14,95.23,59.0,3.5,Myanmar (Burma),MM
2017-10-21 11:24:27,2017-10-21 17:54:27,16.4,94.87,74.0,3.7,"Ayeyarwady, Myanmar (Burma)",MM
2017-10-02 18:13:51,2017-10-03 00:43:51,21.4218,94.5291,96.74,4.6,"Magway Region, Myanmar (Burma)",MM
